{
  "$schema": "https://json-schema.org/draft/2020-12/schema",
  "title": "Research Heuristic",
  "type": "object",
  "required": [
    "heuristic_id", "name", "status", "decision_structure", "rule",
    "supporting_episodes", "boundary_conditions", "failure_signals"
  ],
  "properties": {
    "heuristic_id": {"type": "string"},
    "name": {"type": "string"},
    "status": {"enum": ["candidate", "provisional", "validated", "rejected"]},
    "lens_family": {
      "enum": ["scientific_judgment", "methodological_stance", "research_strategy"]
    },
    "decision_structure": {"type": "string"},
    "rule": {"type": "string"},
    "operational_actions": {"type": "array", "items": {"type": "string"}},
    "supporting_episodes": {"type": "array", "items": {"type": "string"}},
    "counter_episodes": {"type": "array", "items": {"type": "string"}},
    "boundary_conditions": {"type": "array", "items": {"type": "string"}},
    "failure_signals": {"type": "array", "items": {"type": "string"}},
    "evidence_class": {"enum": ["DIRECT_EVIDENCE", "CROSS_SOURCE_SYNTHESIS"]},
    "specificity": {
      "type": "object",
      "required": [
        "status", "generic_baseline_overlap", "scholar_specificity",
        "framework_contamination", "scholar_added_delta", "specificity_evidence"
      ],
      "properties": {
        "status": {"enum": ["not_tested", "pass", "review", "reject"]},
        "generic_baseline_overlap": {"enum": ["low", "medium", "high", "unknown"]},
        "scholar_specificity": {"enum": ["low", "medium", "high", "unknown"]},
        "framework_contamination": {"enum": ["low", "medium", "high", "unknown"]},
        "scholar_added_delta": {"type": "string"},
        "specificity_evidence": {"type": "array", "items": {"type": "string"}},
        "generic_baseline_comparison": {"type": "string"},
        "other_scholar_overlap": {"type": "string"},
        "notes": {"type": "string"}
      },
      "additionalProperties": true
    },
    "routing": {
      "type": "object",
      "properties": {
        "lens_eligibility": {
          "enum": ["active_lens", "experimental_lens", "generic_absorbed", "excluded"]
        },
        "destination": {
          "enum": ["scholar_lens", "experimental_lens", "domain_baseline_candidate", "excluded"]
        },
        "reason": {"type": "string"}
      },
      "additionalProperties": true
    },
    "notes": {"type": "string"}
  },
  "additionalProperties": true
}
